,,,,,,First intersection,,,,,,,,,MIUDQ,12,design,sight lines,enclosure,"3a. proportion sky (ahead, beyond study area)",What proportion of the view ahead is sky?,Write in %,,,,,,,,,,Minn-Irvine,22,design,sight lines,Significant open view,of object not on segment yes/no,Is there a significant open view of an object not on the block?,Yes,No,,,,,,,,,Minn-Irvine,132,design,transparency,Buildings-blank walls,some or a lot/few/none/NA,How many buildings have blank walls?,Some or a lot,Few,None,,,,,,,,MIUDQ,19,design,transparency,transparency,"1. proportion windows at street level (your side, within study area)",What proportion of the building fronts are windows at street level?,Write in %,Not applicable-no buildings,,,,,,,,,PEDS,32,design,,Articulation,in building designs-little or no/some/highly,How much articulation is there is building designs?,Little or no,Some,Highly articulated,,,,,,,,MIUDQ,1,design,,imageability,"1. number of courtyards, plazas, and parks (both sides, within study area)",,,,,,,,,,,,MIUDQ,4,design,,imageability,"4. number of buildings with identifiers (both sides, within study area)",How many buildings with identifiers are there?,None,1,2,3,,,,,,,MIUDQ,21,activity,,transparency,"3. proportion active uses (your side, within study area)",What proportion of the block is active uses?,Write in %,,,,,,,,,,Minn-Irvine,156,aesthetics,architecture,Interesting architecture?,interesting/somewhat interesting/uninteresting,How interesting is the architecture?,Interesting,Somewhat interesting,Uninteresting,,,,,,,,Minn-Irvine,17,aesthetics,art or banners,Banners,to identify neighborhood some or a lot/few/none,Does the segment have banners or monuments that identify the neighborhood?,Banners,Monuments,Both,Neither,,,,,,,MIUDQ,26,aesthetics,art or banners,complexity,"4. number of pieces of public art (both sdies, within study area)",How many pieces of public art do you see?,None,1,2,3,4,5,6,7,8,9,10+Minn-Irvine,119,amenities,dining,Amenities-outdoor dining,some or a lot/few/none,"Are there outdoor dining areas (cafes, outdoor tables at coffee shops or plazas, etc)?",Some or a lot,Few,None,,,,,,,,Minn-Irvine,120,amenities,street furniture,Amenities-benches,some or a lot/few/none,"How many benches (not a bus stop), chairs and/or ledges for sitting?",Some or a lot,Few,None,,,,,,,,MIUDQ,18,amenities,street furniture,human scale,"5. number of pieces of street furniture and other street items (your side, within study area)",How many pieces of street furniture or other street items are there?,None,1,2,3,4,5,6,7,8,9,10+Minn-Irvine,157,amenities,vendors,Street vendors or stalls,some or a lot/few/none,How many street vendors or stalls are there?,Some or a lot,Few,None,,,,,,,,PEDS,26.1,amenities,,Amenities,public garbage cans,Do you see a public garbage can?,Yes,No,,,,,,,,,PEDS,26.3,amenities,,Amenities,water fountain,Do you see a water fountain?,Yes,No,,,,,,,,,Minn-Irvine,122,amenities,,Amenities-heat lamps,some or a lot/few/none,How many heat lamps are there?,Some or a lot,Few,None,,,,,,,,Minn-Irvine,124,amenities,,Public restrooms,yes/no,Are there public restrooms?,Yes,No,,,,,,,,,PEDS,27,amenities,,Wayfinding aids,yes/no,Are there wayfinding aids?,Yes,No,,,,,,,,,MIUDQ,27,activity,,complexity,"5. number of people (your side, within study area)",How many people are on the sidewalk?,None,1,2,3,4,5,6,7,8,9,10+MIUDQ,2,nature,,imageability,"2. number of major landscape features (both sides, beyond study area)",,,,,,,,,,,,MIUDQ,17,nature,,human scale,"4. number of small planters (your side, within study area)",How many small planters are there?,None,1,2,3,4,5,6,7,8,9,10+PEDS,2,nature,slope,Slope,flat/slight hill/steep hill,What is the slope of the segment?,Flat,Slight hill,Steep hill,,,,,,,,PEDS,28,nature,trees,Trees,number shading walking area none or few/some/many or dense,How many trees  shade the walking area?,None or a few,Some,Many or dense,,,,,,,,Minn-Irvine,163,aesthetics,art or banners,Monuments or markers,indicate neighborhood entry yes/no (far end of segment),,,,,,,,,,,,Minn-Irvine,158,aesthetics,art or banners,Public art visible,yes/no,,,,,,,,,,,,NYC HVS,,disorder,,Dilapidated exterior walls,"either major cracks in walls OR missing bricks, siding, or other outside wall material (yes/no)","Do any buildings have either major cracks in walls OR missing bricks, siding, or other outside wall material?",Yes,No,Not applicable - no buildings,,,,,,,,NYC HVS,,disorder,,Broken or boarded up windows,yes/no,Do any buildings have broken or boarded up windows?,Yes,No,Not applicable - no buildings,,,,,,,,Minn-Irvine,128,disorder,,Abandoned buildings/lots,some or a lot/few/none/NA,Are there abandoned buildings or lots on this block?,Some or a lot,Few,None,Not applicable,,,,,,,PHDCN,,disorder,,Abandoned cars,yes/no,Are there abandoned cars?,Yes,No,,,,,,,,,Minn-Irvine,161,disorder,,"Dogs (loose, unsupervised)",yes/no,Are there any loose/unsupervised/barking dogs that seem menacing?,Yes,No,,,,,,,,,Minn-Irvine,141,disorder,,Dumpsters visible,some or a lot/little/none,Are there dumpsters visible?,Some or a lot,Few,None,Minn-Irvine,139,disorder,,Grafitti apparent,some or a lot/little/none (encompasses PHDCN yes/no question),How much graffiti is apparent?,Some or a lot,Little,None,PHDCN,,disorder,,Grafitti painted over,yes/no,Is graffiti painted over apparent?,Yes,No,,Minn-Irvine,140,disorder,,Litter apparent,some or a lot/little/none (encompasses PHDCN yes/no question),How much litter is apparent?,Some or a lot,Little,None,PHDCN,,disorder,,empty beer bottles visible in street,yes/no,Are empty beer bottles visible in the street?,Yes,No,,Minn-Irvine,138,disorder,,Maintenance of buildings,attractive/neutral/unattractive/NA,Describe the general maintenance of the buildings.,Attractive,Neutral,Unattractive,Not applicable-no buildingsPEDS,31,disorder,,Cleanliness,cleanliness and building maintenance poor/fair/good,Describe the overall cleanliness and building maintenance.,Poor (much litter/grafitti/broken facilites),Fair (some litter/grafitti/broken facilites),Good (no litter/grafitti/broken facilites),PHDCN,,disorder,,Needles/syringes on sidewalk,yes/no,deleted - not viewable,,,,PHDCN,,disorder,,"cigarettes, cigars on the street",yes/no,deleted - not viewable,,,,PHDCN,,disorder,,Condoms on sidewalk,yes/no,deleted - not viewable,,,,